"mr blobber","cia torture song","HARdcore blobbyist",1735576405,blobby.mp3
"best shits fishing","best fish",bundesstaat,1735058005,bps.mp3
Adam,protoshits,genesis,0727192005,protoshits.mp3
"pickleman ft. Shrek (from Swamp)","shrek fucking murders a pickle-obsessed home invader with a gun (shrek has the gun)","self-defense in the name of jeesus",1726155205,shrek.mp3
"huere buenzli","a song by a man who has continuos violent seizures induced by Pepperonious 'Peppa' Pig while simultaneously thinking about pickles and having construction occur outside his place of residence and listening to his favorite song; Churz und Buendig","modern art",1732898005,peppus.mp3
"micheal friedbert","birth of michealsoft","triumph of man over nature",1732811605,windowsomething.mp3
"ufo friedbert","HAUPTBAHNOF (aus ufo friedberts 2005 schlager shits kolekschun)","ufoesque schlager",1734971605,hauptbahnhof.mp3
"john timeisit","id quite like to know the current time","temporal acapella",1728747205,idqt.mp3
"sheikh al-friedbert & john timeisit (pleroman reincarnation)","what time is jihad (against brezhnev)","temporal desert",1735576405,td.mp3
"VEB KOMBINAT ROBOTRON","ai-generated samsaracore","rota fortunae",1732811605,samsara.mp3
"john timeisit & ufo friedbert","ufo friedbert hat stimmungsschwankungen","latin temporal horror",1733243605,lth.mp3
geissepeter,"albert friedrich meier has a seizure and fucking dies",buengzli,1734021205,las2.mp3
"john timeisit","zeit eine uhr zu kaufen","temporal soulja boy",1734453205,wtcm.mp3
"sheikh al-friedbert","akoustischer terrorismus","broken 3.5mm audio jack",1736786005,ak.mp3
bestshiński,"finding out the time","extremely serious<br>(no jokes)<br>(Not Funny)",1737131605,ftt.mp3
"jeff jeff jeff","he only wanted to know what time it is","souljaesque motivational",1737131100,heow.mp3
jimmy 'mr peanits' rudinger,in das klub ich tschorkiere es,jorking music,1737458363,jorking.mp3
jimmy 'mr peanits' rudinger,Live Aid: gun peanits explosion syndrome,jorkinger music,1737539463,jorking2.mp3
jimmy 'mr peanits' rudinger,shephards peanits,jorkinger music,1737539464,jorking3.mp3
die sheikh al-friedbert Altersheim Extravaganza Band Nr. 3,die altersheim band stirbt and einer &uuml;berdosis ! :(,senil,1737539465,od.mp3
